id,question,option_a,option_b,option_c,option_d,correct_answer,explanation,category
"81","Which of the following descriptions is incorrect?","(A) Lipomas usually have a capsule at the margin, clearly demarcated from surrounding tissues. Morphologically, they can be classified into conventional, fibrolipoma, angiolipoma, spindle cell lipoma, etc.","(B) Liposarcomas commonly occur in the limbs or retroperitoneum, in locations closer to the skin and more superficial, making them easier to excise.","(C) Liposarcomas can be further classified into atypical lipomatous tumor/well-differentiated liposarcoma, myxoid liposarcoma, and pleomorphic liposarcoma.","(D) Pleomorphic liposarcomas are usually more aggressive and prone to distant metastasis.","B","(B) 錯 誤。 脂 肪 肉 瘤 (Liposarcoma) 常 見 於 四 肢 近 端 或 腹 膜 後 (retroperitoneum) ， 且位 於 深 部 (deep part) ， 並 非 靠 近 皮 膚 或 表 淺 部 位。 (C)(D)","肌肉骨骼病理學(2) 陳建亨"
"82","Which of the following descriptions is incorrect?","(A) A motor unit consists of a motor neuron and the muscle bundles it innervates.","(B ) Type I muscle fibers perform aerobic exercise, allowing for prolonged contraction; they contain less intracellular fat and more glycogen. Type II muscle fibers perform anaerobic exercise, generating greater contraction force but with lower mitochondrial density. These two muscle types can convert into each other depending on reinnervation by different neurons.","(C) The connective tissue surrounding a single skeletal muscle fiber is called the endomysium.","(D) If the motor neuron in a motor unit is impaired, causing pathology in its innervated muscle group, it is called neuropathic myopathy. The muscle shows features such as grouped atrophy and fiber type grouping.","B","Type I muscle fibers perform aerobic exercise, allowing for prolonged contraction; they contain less intracellular fat and more glycogen. 這 句 描 述 中 ， 前 半 段 正 確 ， 但 是 type I muscle fibers is higher in its lipid content and lower in its glycogen content. Type II muscle fibers perform anaerobic exercise, generating greater contraction force but with lower mitochondrial density. 這 句 描 述 是 正 確 的。 These two muscle types can convert into each other depending on reinnervation by different neurons. 老 師 在 上 課 時 也 有 口 述 ： 「通 常 一 條 神 經 支 配 同 一 種 肌 肉 ， 但 type I 和 type II 在 特 定 情 況 下 可 互 換 ， 稍 後 會 提 到 (fiber type grouping) 」 因 此 這 句 是 正確的。","肌肉骨骼病理學(2) 陳建亨"
"83","Which of the following descriptions is incorrect?","(A) Total muscle mass and maximal muscle strength peak in youth and gradually decline with age.","(B) If this decline occurs too rapidly, resulting in muscle mass and maximal strength falling below a certain standard, it is currently called sarcopenia.","(C) Sarcopenia mainly affects daily activities and does not increase the risk of cardiopulmonary diseases; besides aging, it can also be caused by neurological disorders, lack of physical training, and obesity.","(D) Using muscle strength as an indicator, men with a dominant-hand grip strength below 27 kg should be concerned about sarcopenia.","C","(A) 正 確。 根 據 講 義 第 94 圖 表 ， 肌 力 在 「年 輕 時」 達 到 最 大 化 ， 在 「中 年 時」 維 持 ， 並 在「老 年 時」 最 小 化 流 失 （即 逐 漸 下 降）。 (B) 正 確。 講 義 第 94 、 95 頁 將 肌 少 症 定 義 為 與 老 化 相 關 的 肌 肉 流 失 。 圖 表 也 顯 示 當 肌力 下 降 到 「低 體 能 表 現」 或 「臨 界 失 能」 的 標 準 時 ， 即 需 「預 防 和 延 後 肌 少 症 發 生」。 該 敘述 符 合 肌 少 症 的 臨 床 概 念。 (C) 錯 誤。 肌 少 症 （ Sarcopenia ） 的 影 響 包 括 ： 跌 倒、 骨 折、 身 體 失 能、 死 亡 率 ， 以 及 心 臟疾 病 (Cardiac dz) 、 呼 吸 系 統 疾 病 (respiratory dz) 和 認 知 障 礙 。 因 此 ， 肌 少 症 是 會增 加 心 肺 疾 病 風 險 的。 (D) 正 確。 在 「肌 肉 力 量 切 點」 中 ， 男 性 慣 用 手 握 力 的 切 點 為 < 27 kg 。","肌肉骨骼病理學(2) 陳建亨"
"84","Which of the following statements is the most appropriate?","(A) Synovial sarcoma commonly shows t(X;18)(p11;q11), resulting in SS18-SSX1, SS18-SSX2, or SS18- SSX4 gene fusions.","(B) Ewing sarcoma commonly shows t(11;22)(q24;q12) or t(21;22)(q22;q12), resulting in EWS-FLI1 or EWS-ERG gene fusions.","(C) Alveolar rhabdomyosarcoma can show t(2;13)(q35;q14) or t(1;13)(p36;q14), resulting in PAX3- FOXO1 or PAX7-FOXO1 gene fusions.","(D) All of the above descriptions are correct.","D","本 題 Ａ Ｂ Ｃ 三 個 選 項 皆 正 確 ， 就 請 記 起 來 來 源 各 自 在 老 師 的 講 義 裡 （Ａ） 選 項 在 老 師 講 義 第 67 頁 ， 如 下 方 ： （ B ） 選 項 在 老 師 講 義 第 11 頁 表 格 第 一 行 ， 如 下 方 ： （Ｃ） 選 項 在 老 師 講 義 第 51 頁 ， 如 下 方 ：","肌肉骨骼病理學(2) 陳建亨"
"85","Which artery is the major blood supply to the hip joint?","(A) Superior gluteal artery","(B) Medial and lateral circumflex femoral arteries","(C) Obturator artery","(D) Femoral profunda artery","B","根 據 老 師 的 slide ， major blood supply to the hip joint 就 是 Medial and lateral circumflex femoral arteries 喔！ 記 憶 題 ， 常 考 ， 背 起 來 吧！","髖及膝關節功能解剖學 李忠祐"
"86","Which movement combination of the hip reproduces pain in piriformis syndrome during examination?","(A) Flexion, abduction, external rotation","(B) Flexion, adduction, internal rotation","(C) Extension, abduction, external rotation","(D) Extension, adduction, internal rotation","B","","髖及膝關節功能解剖學 李忠祐"
"87","In the knee’s screw-home mechanism (open chain), during the last 20° of extension, the tibia:","(A) Internally rotates, tightening cruciate ligaments","(B) Externally rotates, tightening cruciate ligaments","(C) Internally rotates, loosening cruciate ligaments","(D) Externally rotates, loosening cruciate ligaments","B","screw home mechanism 在 knee extension 最 後 的 20 度 會 向 外 旋 轉 至 鎖 定 ， 同 時 使ACL/PCL 繃 緊 ， 使 tibia 穩 定。","髖及膝關節功能解剖學 李忠祐"
"88","Which molecule is most directly associated with angiogenesis during fracture healing?","(A) TNF α","(B) IL-6","(C) VEGF","(D) BMP-2","C","老 師 上 課 特 別 強 調","骨折的生物力學及癒合 劉文智"
"89","Which of the following best characterizes secondary bone healing?","(A) Requires absolute stability and osteonal remodeling","(B) Occurs only in cortical bone","(C) Involves both intramembranous and endochondral ossification","(D) Leads to the direct formation of new osteons","C","(A) 需 要 絕 對 穩 定 性 和 骨 單 位 重 塑 (osteonal remodeling) ： 這 描 述 的 是 一 期 骨 癒 合 (Primary Healing) 。 繼 發 性 骨 癒 合 要 求 相 對 穩 定 性 (Relative stability) 。 (B) 只 發 生 在 皮 質 骨 (cortical bone) ： 繼 發 性 骨 癒 合 是 一 種 通 用 的 癒 合 機 制 ， 在 相 對 穩定 的 情 況 下 發 生。 海 綿 骨 (Cancellous bone) 的 癒 合 在 發 炎 期 後 主 要 由 膜 內 骨 化 主 導， 且 不 形 成 明 顯 的 外 部 骨 痂 ， 但 繼 發 性 癒 合 並 非 只 發 生 在 皮 質 骨 中。 (C) 涉 及 膜 內 骨 化 (intramembranous) 和 軟 骨 內 骨 化 (endochondral) 兩 種 過 程 繼 發 性 骨 癒 合 ， 也 被 稱 為 間 接 骨 癒 合 （透 過 骨 痂 形 成） ， 其 特 點 是 膜 內 骨 化 和 軟 骨 內 骨化 共 同 作 用 。 (D) 導 致 新 骨 單 位 (osteons) 的 直 接 形 成 ： 骨 單 位 重 塑 (Osteonal remodeling) 是 一 期骨 癒 合 的 核 心 過 程 。 繼 發 性 骨 癒 合 的 初 期 是 透 過 軟 骨 痂 和 硬 骨 痂 的 形 成 ， 最 終 的 重塑 階 段 才 涉 及 骨 單 位 的 重 組 ， 但 不 是 其 直 接 或 核 心 的 形 成 機 制。","骨折的生物力學及癒合 劉文智"
"90","Which of the following statements about fracture biomechanics is TRUE?","(A) Increased implant-bone contact improves bone perfusion","(B) Relative stability allows micromotion at the fracture site","(C) Reaming for intramedullary nails increases endosteal blood flow","(D) Absolute stability encourages callus formation","B","(A) larger implant-bone contact: reducing bone perfusion (C)reaming for intramedullary nails (IM nails): reduces endosteal blood flow (D)callus formation : relative stability 說 明 : 在 骨 折 癒 合 的 生 物 力 學 中 有 Primary/ Secondary healing, 其 中 Secondary Healing 講 義 中 提 到 ● Indirect healing by callus formation ○ Relative stability ○ Both intramembranous and endochondral bone formation","骨折的生物力學及癒合 劉文智"
"91","Which of the following statements about the sagittal band is correct?","(A) It extends the middle phalanx during metacarpophalangeal joint (MCPJ) extension.","(B) It attaches to the dorsal hood and stabilizes the lateral band.","(C) It assists in proximal phalanx extension and stabilizes the extensor tendon at the MCPJ.","(D) It allows distal interphalangeal joint extension when MCPJ is hyperextended.","C","Sagittal bands: ● attaches to the volar plate ● extend the P1 ● the extrinsic extensors can’t extend the P2 while MCPJ is hyperextended Also: ● Central slip extends the middle phalanx ● Triangular & Transverse reticular ligament stabilize the lateral band ● Terminal tendon allows DIP extension","手部、腕部骨骼功能解剖學 劉文智"
"92","Which of the following is a secondary stabilizer of the distal radioulnar joint (DRUJ)?","(A) Extensor carpi ulnaris tendon sheath","(B) Dordsal radiocarpal ligament","(C) Deep dorsal radioulnar ligament","(D) Extensor retinaculum","A","以 下 為 secondary stabilizer of the distal radioulnar joint (DRUJ) ： ECU (extensor carpi ulnaris) tendon sheath 6th dorsal compartment (ECU) sub-sheath Deep head of pronator quadratus(PQ) Interosseous lig. Of the forearm(central band) Ulnotriquetral lig. Ulnolunate lig.","手部、腕部骨骼功能解剖學 劉文智"
"93","Which nerve innervates the abductor pollicis muscle?","(A) Radial nerve","(B) Median nerve","(C) Ulnar nerve","(D) Anterior interosseous nerve","送分","abductor pollicis brevis(APB) 由 median n. 支 配 abductor pollicis longus(APL) 則 由 radial n. 支 配","手部、腕部骨骼功能解剖學 劉文智"
"94","Drugs that act on the central nervous system to induce skeletal muscle relaxation include the following drugs, except which one?","(A) Central alpha-2 agonists","(B) Depolarizing muscle relaxants","(C) Tricyclic antidepressants","(D) Antihistamines","B","","肌肉鬆弛劑之藥理學 程廣義"
"95","botox ( clostridium botulinum) acting which of the following to induce muscle relaxation?","(A) Gamma-aminobutyric acid (GABA) type B receptors","(B) snare protein","(C) Muscarinic receptors","(D) Ligand-gated sodium channels","B","","肌肉鬆弛劑之藥理學 程廣義"
"96","Characteristics of muscle pain, relative to cutaneous pain, include all of the following except:","(A) Poorly localized","(B) Burning and cutting","(C) Easily pain referral","(D) Difficult to tolerate","B","由 表 格 可 以 看 出 cutaneous pain 才 是 burning and cutting","肌肉鬆弛劑之藥理學 程廣義"